question_text,answer_1,points_1,answer_2,points_2,answer_3,points_3,answer_4,points_4,answer_5,points_5,answer_6,points_6,answer_7,points_7,answer_8,points_8
"Name something you might find in a kitchen","Spoon",45,"Plate",30,"Cup",10,"Knife",8,"Fork",5,,,,,,
"Name something you wear on your feet","Shoes",50,"Socks",30,"Sandals",8,"Boots",6,"Slippers",3,,,,,,
"Name a fruit","Apple",40,"Banana",30,"Orange",15,"Grape",8,"Pear",4,,,,,,
"Name a kind of weather","Sunny",60,"Rainy",20,"Cloudy",10,"Windy",5,"Snowy",3,,,,,,
"Name a reason to call a friend","Celebrate",35,"Help",25,"Chat",20,"Ask advice",10,"Share news",6,,,,,,
